"name","type","url","dataset_DOI","description","published_at","publisher","citationHtml","identifier_of_dataverse","name_of_dataverse","citation","storageIdentifier","keywords","subjects","fileCount","versionId","versionState","majorVersion","minorVersion","createdAt","updatedAt","contacts","publications","producers","geographicCoverage","authors","dataSources","viewsTotal","viewsUnique","downloadsTotal","downloadsUnique","storage_size_bytes","storage_size_GB"
"Data set of a laboratory experiment on the impact of the conveyance porosity of an urban block on the flood risk assessment","dataset","https://doi.org/10.57745/UJOCJ8","doi:10.57745/UJOCJ8","This dataset is composed of experimental measurements collected on a 5.4 m long and 3.2 m wide laboratory platform, which represents an urban area consisting of a porous rectangular city block (rectangular openings in the block walls) and four surrounding streets, 0.15 m wide (labeled, right, left, downstream and upstream). The experiments were performed under steady flow conditions. The total inlet discharge, QinT = 6.5 l/s, was partitioned between the inflow in the right street (Qin1 = 4.5 l/s) and left street (Qin2 = 2.0 l/s). Measurements were conducted by (i) varying the number and location of openings in the block sidewalls (cases C00-00, C100-00, C00-04, C00-12, C06-00, C19-00, C06-04, C19-12); and (ii) for a fixed number of openings in the block walls (four in total), varying their location (cases C1, C2, C3, C4, C5). We present here the following measurements: (1) time-averaged flow depths within the city block and in the surrounding streets and (2) time-averaged surface velocities within the city block and in the surrounding streets.","2023-01-05T11:51:30Z","Experimental - Observation - Simulation","Mej&iacute;a-Morales, Miguel Angel; Mignot, Emmanuel; Paquier, Andr&eacute;; Proust, S&eacute;bastien, 2023, ""Data set of a laboratory experiment on the impact of the conveyance porosity of an urban block on the flood risk assessment"", <a href=""https://doi.org/10.57745/UJOCJ8"" target=""_blank"">https://doi.org/10.57745/UJOCJ8</a>, Recherche Data Gouv, V1, UNF:6:Md2Yh9DNuCDyRl3U3kNGCw== [fileUNF]","eos","Experimental - Observation - Simulation","Mejía-Morales, Miguel Angel; Mignot, Emmanuel; Paquier, André; Proust, Sébastien, 2023, ""Data set of a laboratory experiment on the impact of the conveyance porosity of an urban block on the flood risk assessment"", https://doi.org/10.57745/UJOCJ8, Recherche Data Gouv, V1, UNF:6:Md2Yh9DNuCDyRl3U3kNGCw== [fileUNF]","inrae://10.57745/UJOCJ8","Urban flooding; Porosity; Shallow flows; Flood risk; Flow intrusion; Floodwater","Earth and Environmental Sciences; Physics",48,265590,"RELEASED",1,0,"2022-12-07T08:14:56Z","2023-02-20T14:25:40Z","PROUST, SEBASTIEN; INRAE","Miguel Angel Mejía-Morales, Emmanuel Mignot, André Paquier, Darius Sigaud, Sébastien Proust, Impact of the porosity of an urban block on the flood risk assessment: A laboratory experiment, Journal of Hydrology, Volume 602, 2021, https://doi.org/10.1016/j.jhydrol.2021.126715.; https://doi.org/10.1016/j.jhydrol.2021.126715; Mejia Morales, M. A. (2022). Influence of the flow exchanges between streets and a city block during urban floods: Laboratory experiments under steady and unsteady flow conditions. PhD Thesis, Fluid mechanics [physics.class-ph]. Université de Lyon - INSA Lyon. English.","INRAE","","Mejía-Morales, Miguel Angel; Mignot, Emmanuel; Paquier, André; Proust, Sébastien","",1372,382,711,27,NA,NA
"MAKAHO : Analyse de tendances hydrologiques du Réseau de Référence pour la Surveillance des Étiages","dataset","https://doi.org/10.57745/LNBEGZ","doi:10.57745/LNBEGZ","MAKAHO (pour MAnn-Kendall Analysis of Hydrological Observations) est un système de visualisation cartographique interactif permettant de calculer les tendances présentes dans les données des stations hydrométriques aux débits peu influencés par les actions humaines. Le test de Mann-Kendall permet d’analyser la significativité des tendances de variables hydrologiques sur les différentes composantes du régime des cours d'eau (étiages, moyennes-eaux, crues), à mettre ensuite en relation avec les impacts du changement climatique sur l’hydrologie de surface. Le jeu de donnée présenté ici correspond à un échantillon représentatif de ce que peut produire MAKAHO sur la période 1968 - 2020 pour une agrégation considérée comme optimale.","2024-05-22T12:18:28Z","RIVERLY","HERAUT, Louis; LANG, Michel; RENARD, Benjamin; SAUQUET, Eric; VIDAL, Jean-Philippe, 2024, ""MAKAHO : Analyse de tendances hydrologiques du R&eacute;seau de R&eacute;f&eacute;rence pour la Surveillance des &Eacute;tiages"", <a href=""https://doi.org/10.57745/LNBEGZ"" target=""_blank"">https://doi.org/10.57745/LNBEGZ</a>, Recherche Data Gouv, V3, UNF:6:AVc3GLx35yMuQgsk7swZGA== [fileUNF]","riverly","RIVERLY","HERAUT, Louis; LANG, Michel; RENARD, Benjamin; SAUQUET, Eric; VIDAL, Jean-Philippe, 2024, ""MAKAHO : Analyse de tendances hydrologiques du Réseau de Référence pour la Surveillance des Étiages"", https://doi.org/10.57745/LNBEGZ, Recherche Data Gouv, V3, UNF:6:AVc3GLx35yMuQgsk7swZGA== [fileUNF]","inrae://10.57745/LNBEGZ","analyse de tendance; hydrologie de surface; changement climatique; étiage; régime de crue; disponibilité en eau; test de Mann-Kendall; RRSE","Earth and Environmental Sciences",69,276347,"RELEASED",3,8,"2024-05-19T03:11:36Z","2025-03-08T14:37:06Z","HERAUT, Louis; INRAE, UR RiverLy, Villeurbanne, France","Louis Heraut, Michel Lang, Benjamin Renard, Jean-Philippe Vidal, Eric Sauquet, et al.. MAKAHO. 2022; https://hal.inrae.fr/hal-04837537; Louis Héraut, Michel Lang, Ignazio Giuntoli, Benjamin Renard, Éric Sauquet, et al.. MAKAHO : Analyse de tendances hydrologiques - Ou comment faire le pont. Shiny::INRAE, INRAE SK8, Feb 2025, Montpellier, France.; https://hal.inrae.fr/hal-04983136; Louis Heraut, Michel Lang. Note explicative : MAKAHO. INRAE. 2022.; https://hal.inrae.fr/hal-04421504","INRAE UR RiverLy","","HERAUT, Louis; LANG, Michel; RENARD, Benjamin; SAUQUET, Eric; VIDAL, Jean-Philippe","Données issues de l'<a href=""https://www.hydro.eaufrance.fr/"" target=""_blank"" rel=""nofollow"">HydroPortail</a>; Analyse de tendance réalisable sur <a href=""https://makaho.sk8.inrae.fr/"" target=""_blank"" rel=""nofollow"">MAKAHO</a>",853,341,171,20,303970663,0.283
"Suspended sediment measurements in the Isère River at Grenoble Campus","dataset","https://doi.org/10.57745/YTCYSX","doi:10.57745/YTCYSX","Suspended sediment measurements, including information on sand and fine sediment concentration and grain size, ADCP and bedload measurements","2023-09-06T14:32:03Z","RIVERLY","Marggraf, Jessica; Camenen, Beno&icirc;t; Le Coz, J&eacute;r&ocirc;me; Dramais, Guillaume; Lauters, Fran&ccedil;ois; Pierrefeu, Gilles, 2023, ""Suspended sediment measurements in the Is&egrave;re River at Grenoble Campus"", <a href=""https://doi.org/10.57745/YTCYSX"" target=""_blank"">https://doi.org/10.57745/YTCYSX</a>, Recherche Data Gouv, V1","riverly","RIVERLY","Marggraf, Jessica; Camenen, Benoît; Le Coz, Jérôme; Dramais, Guillaume; Lauters, François; Pierrefeu, Gilles, 2023, ""Suspended sediment measurements in the Isère River at Grenoble Campus"", https://doi.org/10.57745/YTCYSX, Recherche Data Gouv, V1","inrae://10.57745/YTCYSX","Suspended sediment; Suspended sand; Sand; River; ADCP","Earth and Environmental Sciences",139,271026,"RELEASED",1,1,"2023-08-31T13:14:54Z","2024-03-12T14:47:40Z","Laible, Jessica; INRAE; Dramais, Guillaume; INRAE","","","","Marggraf, Jessica; Camenen, Benoît; Le Coz, Jérôme; Dramais, Guillaume; Lauters, François; Pierrefeu, Gilles","",1104,247,569,5,275319785,0.256
"Dataset of a laboratory experiment on shallow mixing layers over smooth bed in a tilted open channel","dataset","https://doi.org/10.57745/EQURJN","doi:10.57745/EQURJN","This dataset is composed of experimental measurements collected in an 18 m long and 2 m wide tilted open-channel flume. The focus is on shallow mixing layers developing behind a vertical splitter plate over a hydraulically smooth bed. Four values of the total flow rate Q were used (120, 60, 30, and 14 l/s) to vary vertical flow confinement (i.e. flow depth). For each Q-value, the inflow conditions were changed. The experiments start with uniform flow conditions, i.e., with Q1 = Q2, where Q1 is the right-hand inflow discharge and Q2 is the left-hand inflow discharge, with Q = Q1+Q2. Then, for a given Q-value, shallow mixing layers were created by varying the flow partition between the two inlet tanks (with Q1 < Q2). Twenty flow cases were investigated, including four uniform flows and 16 mixing layers. Each flow case is identified by its values of Q1 and Q2, e.g., case 03-27 corresponds to Q1 = 3 l/s and Q2 = 27 l/s. We present here the measurements of (1) water flow depths, (2) one-point velocity measurements; and (3) two-point velocity measurements. They enabled us to explore the flow structure along the whole length of the flume, including the time-averaged flow, the turbulence statistics, and the large-scale coherent structures.","2024-11-25T09:14:05Z","Experimental - Observation - Simulation","PROUST, SEBASTIEN; BERNI, CELINE; NIKORA, VLADIMIR, 2022, ""Dataset of a laboratory experiment on shallow mixing layers over smooth bed in a tilted open channel"", <a href=""https://doi.org/10.57745/EQURJN"" target=""_blank"">https://doi.org/10.57745/EQURJN</a>, Recherche Data Gouv, V2, UNF:6:fSznfN4puOs6wLlsjq5baA== [fileUNF]","eos","Experimental - Observation - Simulation","PROUST, SEBASTIEN; BERNI, CELINE; NIKORA, VLADIMIR, 2022, ""Dataset of a laboratory experiment on shallow mixing layers over smooth bed in a tilted open channel"", https://doi.org/10.57745/EQURJN, Recherche Data Gouv, V2, UNF:6:fSznfN4puOs6wLlsjq5baA== [fileUNF]","inrae://10.57745/EQURJN","Fluid Mechanics; Hydraulics","Earth and Environmental Sciences; Physics",101,265377,"RELEASED",2,0,"2022-07-25T07:22:19Z","2024-11-25T09:14:05Z","PROUST, SEBASTIEN; INRAE","Proust, S., Berni, C., Nikora, V. Shallow mixing layers over hydraulically smooth bottom in a tilted open channel. (2022) J. Fluid Mech. Volume 951 , A17, doi:10.1017/jfm.2022.818; https://doi.org/10.1017/jfm.2022.818","PROUST, SEBASTIEN","","PROUST, SEBASTIEN; BERNI, CELINE; NIKORA, VLADIMIR","",3769,794,373,13,NA,NA
"Field measurements of clogging","dataset","https://doi.org/10.57745/WN3HNM","doi:10.57745/WN3HNM","The data set includes results of clogging estimation using infiltration tests, Bou-Rouch samples, as well as McNeil samples collected in an Old-Rhône reach, North of Lyon, France","2025-03-12T09:40:15Z","RIVERLY","CAMENEN, BENOIT, 2025, ""Field measurements of clogging"", <a href=""https://doi.org/10.57745/WN3HNM"" target=""_blank"">https://doi.org/10.57745/WN3HNM</a>, Recherche Data Gouv, V1, UNF:6:nRAuXooPYZFDzCtk96e5ZQ== [fileUNF]","riverly","RIVERLY","CAMENEN, BENOIT, 2025, ""Field measurements of clogging"", https://doi.org/10.57745/WN3HNM, Recherche Data Gouv, V1, UNF:6:nRAuXooPYZFDzCtk96e5ZQ== [fileUNF]","inrae://10.57745/WN3HNM","clogging","Earth and Environmental Sciences",4,276386,"RELEASED",1,0,"2025-03-12T09:07:39Z","2025-03-19T08:08:53Z","CAMENEN, BENOIT; INRAE","J. Deng B. Camenen D. Hernandez J. Liégeois &amp; A. Bonnefoy (2025). Methodological evaluation of riverbed clogging - insight from field measurements. River Research &amp; Applications","UR RiverLy, équipe hydraulique des rivières","","CAMENEN, BENOIT","",44,32,0,0,585949,0.001
"PASHA (PedAgogic StocHastic data Assimilation)","dataset","https://doi.org/10.57745/BC1EFA","doi:10.57745/BC1EFA","The global structure of the package is mainly composed of a model class which implements the model and a DAscheme class which implements the data assimilation method that is used. The model class is composed of a set of methods allowing to initialize the model, to propagate it on one or several consecutive time steps and to update the initial conditions and/or the parameters for the next assimilation cycle. The DAscheme class allows to drive the whole assimilation experiment by performing alternating prediction and analysis steps. Different variants of the Kalman filter are integrated in the form of classes inheriting from DAscheme: EnKF (two integrated variants: Ensemble Transform Kalman Filter (Bishop et al. 2001) and stochastic version of EnKF as proposed in Burgers et al. 1998), ES ES-MDA iEnKS For each of them, the analysis and DAfull methods are redefined according to the strategy used for the analysis and according to the type of assimilation considered (filter or fixed point smoother or fixed interval smoother with fixed interval). No numerical optimization has been done and the algorithms have been kept as compact and transparent as possible, which allows a better overview of the mathematical theory they implement. Moreover, an ObsInfo class allows to provide all the information related to the observations (values, frequency, observation operator, error covariance matrix,) and a Trajectory class allows to extract some values from the state vector to constitute temporal trajectories. The ObsInfo and Trajectory classes also include a set of methods facilitating the visualization of the temporal evolution of the set of observations and their errors. Finally, the PerfStudy class allows to compute a set of of metrics allowing to evaluate the quality of the assimilation results in relation to a reference trajectory (bias, RMSE, dispersion, CRPS).","2025-01-28T16:44:16Z","RIVERLY","ROUZIES, EMILIE, 2025, ""PASHA (PedAgogic StocHastic data Assimilation)"", <a href=""https://doi.org/10.57745/BC1EFA"" target=""_blank"">https://doi.org/10.57745/BC1EFA</a>, Recherche Data Gouv, V1","riverly","RIVERLY","ROUZIES, EMILIE, 2025, ""PASHA (PedAgogic StocHastic data Assimilation)"", https://doi.org/10.57745/BC1EFA, Recherche Data Gouv, V1","inrae://10.57745/BC1EFA","","Computer and Information Science",0,275669,"RELEASED",1,0,"2025-01-28T16:35:03Z","2025-01-28T16:44:16Z","LAUVERNET, CLAIRE; INRAE","Rouzies, Emilie, 2023. Quantifying and reducing the uncertainties in a pesticide transfer model at the catchment scale. Phd Thesis Université Grenoble-Alpes.; https://hal.inrae.fr/tel-04659164v2","ROUZIES, EMILIE","","ROUZIES, EMILIE","",42,33,0,0,0,0
"Dataset of a laboratory study on flows in a compound open channel with transverse currents","dataset","https://doi.org/10.57745/HJKRYH","doi:10.57745/HJKRYH","This dataset is composed of experimental measurements collected in an 18 m long and 3 m wide tilted open-channel flume, consisting of a central smooth-bed main channel (MC) and two adjacent rough-surface floodplains (FPs). Streamwise depth-uniform and non-uniform flows were both investigated. The non-uniform flows were generated by imposing an imbalance in the discharge distribution between MC and FPs at the flume entrance. They involve transverse currents directed from MC to FPs and vice versa. The focus is on assessing the effects of the transverse currents on the flow structure within the shallow mixing layer developing between MC and FPs. Six flow cases were investigated varying the inflow partition between MC and FP, keeping the total flow rate (Q = 114 L/s) unchanged. Each flow case is identified by its FP discharge value, denoted as Qf. The depth-uniform flow scenario corresponds to Qf = 8 L/s. The five non-uniform flow scenarios correspond to Qf = 0, 4, 12, 16 and 20 L/s. We present here the measurements of (1) water flow depths, (2) one-point velocity measurements; and (3) two-point velocity measurements. They enabled us to explore the flow structure along the whole length of the flume, including the time-averaged flow, the turbulence statistics, and the large-scale coherent structures (Kelvin-Helmholtz vortices, large- and very-large- scale motions).","2025-03-25T11:36:53Z","RIVERLY","PROUST, SEBASTIEN; NIKORA, VLADIMIR I., 2025, ""Dataset of a laboratory study on flows in a compound open channel with transverse currents"", <a href=""https://doi.org/10.57745/HJKRYH"" target=""_blank"">https://doi.org/10.57745/HJKRYH</a>, Recherche Data Gouv, V1, UNF:6:0Ov9GOlqUlOmeV+su2c91A== [fileUNF]","riverly","RIVERLY","PROUST, SEBASTIEN; NIKORA, VLADIMIR I., 2025, ""Dataset of a laboratory study on flows in a compound open channel with transverse currents"", https://doi.org/10.57745/HJKRYH, Recherche Data Gouv, V1, UNF:6:0Ov9GOlqUlOmeV+su2c91A== [fileUNF]","inrae://10.57745/HJKRYH","river dynamics; shallow water flows; shear layer turbulence; Kelvin-Helmholtz vortices; Large-scale motions; Very-large-scale motions; Secondary flows","Earth and Environmental Sciences; Physics",157,265602,"RELEASED",1,0,"2022-12-07T15:56:02Z","2025-03-25T11:36:53Z","PROUST, SEBASTIEN; INRAE","Proust, S., &amp; Nikora, V. I. (2020). Compound open-channel flows: effects of transverse currents on the flow structure. J. Fluid Mech., 885(A24), 1-38.; https://doi.org/10.1017/jfm.2019.973","INRAE","","PROUST, SEBASTIEN; NIKORA, VLADIMIR I.","",507,24,314,1,881410,0.001
"Flow intermittence indicators from the projection simulations (1985-2100) in the Albarine DRN (France)","dataset","https://doi.org/10.57745/VA4YI0","doi:10.57745/VA4YI0","Statistical monthly and yearly flow intermittence indicators calculated from the simulated daily state of flow in the Albarine DRN (France). Indicators are provided for 3 SSP scenarios and 5 climate models on the projection periods (1985-2014 and 2015-2100).","2025-04-01T16:57:41Z","DRYvER-WP1 Hydrological modelling catchment scale Europe","Mimeau, Louise; K&uuml;nne, Annika; Devers, Alexandre; Branger, Flora; Kralisch, Sven; Lauvernet, Claire; Vidal, Jean-Philippe, 2025, ""Flow intermittence indicators from the projection simulations (1985-2100) in the Albarine DRN (France)"", <a href=""https://doi.org/10.57745/VA4YI0"" target=""_blank"">https://doi.org/10.57745/VA4YI0</a>, Recherche Data Gouv, V2","DRYvER-WP1-DRN-EU","DRYvER-WP1 Hydrological modelling catchment scale Europe","Mimeau, Louise; Künne, Annika; Devers, Alexandre; Branger, Flora; Kralisch, Sven; Lauvernet, Claire; Vidal, Jean-Philippe, 2025, ""Flow intermittence indicators from the projection simulations (1985-2100) in the Albarine DRN (France)"", https://doi.org/10.57745/VA4YI0, Recherche Data Gouv, V2","inrae://10.57745/VA4YI0","hydrological intermittence; climate change","Earth and Environmental Sciences",401,276863,"RELEASED",2,0,"2025-02-14T18:55:56Z","2025-04-01T16:57:41Z","Mimeau, Louise; INRAE, UR RiverLy, Villeurbanne, France","Mimeau, L., Künne, A., Branger, F., Kralisch, S., Devers, A., and Vidal, J.-P.: Flow intermittence prediction using a hybrid hydrological modelling approach: influence of observed intermittence data on the training of a random forest model, Hydrol. Earth Syst. Sci. 2024; Mimeau, L., Künne, A., Devers, A., Branger, F., Kralisch, S., Lauvernet, C., Vidal, J.-P., Bonada, N., Csabai, Z., Mykrä, H., Pařil, P., Polović, L., and Datry, T.: Projections of streamflow intermittence under climate change in European drying river networks, Hydrol. Earth Syst. Sci. 2025","DRYvER","France; Albarine catchment,","Mimeau, Louise; Künne, Annika; Devers, Alexandre; Branger, Flora; Kralisch, Sven; Lauvernet, Claire; Vidal, Jean-Philippe","",474,40,4,2,469613805,0.437
"J2000 Hydrological model of the Vantaanjoki-Lepsämänjoki river basin (Finland)","dataset","https://doi.org/10.57745/QPF3CO","doi:10.57745/QPF3CO","J2K_Vantaanjoki: J2000 hydrological model for the Vantaanjoki river basin (which includes the Lepsämänjoki sub-basin).","2025-02-26T17:34:42Z","DRYvER-WP1 Hydrological modelling catchment scale Europe","Mimeau, Louise; Branger, Flora; K&uuml;nne, Annika; Kralisch, Sven, 2025, ""J2000 Hydrological model of the Vantaanjoki-Leps&auml;m&auml;njoki river basin (Finland)"", <a href=""https://doi.org/10.57745/QPF3CO"" target=""_blank"">https://doi.org/10.57745/QPF3CO</a>, Recherche Data Gouv, V2","DRYvER-WP1-DRN-EU","DRYvER-WP1 Hydrological modelling catchment scale Europe","Mimeau, Louise; Branger, Flora; Künne, Annika; Kralisch, Sven, 2025, ""J2000 Hydrological model of the Vantaanjoki-Lepsämänjoki river basin (Finland)"", https://doi.org/10.57745/QPF3CO, Recherche Data Gouv, V2","inrae://10.57745/QPF3CO","hydrological model","Earth and Environmental Sciences",2,276818,"RELEASED",2,1,"2025-02-14T15:29:32Z","2025-03-31T13:56:18Z","Mimeau, Louise; INRAE, UR RiverLy, Villeurbanne, France","Mimeau, L., Künne, A., Branger, F., Kralisch, S., Devers, A., and Vidal, J.-P.: Flow intermittence prediction using a hybrid hydrological modelling approach: influence of observed intermittence data on the training of a random forest model, Hydrol. Earth Syst. Sci. 2024; Mimeau, L., Künne, A., Devers, A., Branger, F., Kralisch, S., Lauvernet, C., Vidal, J.-P., Bonada, N., Csabai, Z., Mykrä, H., Pařil, P., Polović, L., and Datry, T.: Projections of streamflow intermittence under climate change in European drying river networks, Hydrol. Earth Syst. Sci. 2025","DRYvER","Finland; Lepsämänjoki catchment,","Mimeau, Louise; Branger, Flora; Künne, Annika; Kralisch, Sven","",47,34,2,2,29008686,0.027
"J2000 Hydrological model of the Fekete-Bukkosdi river basin (Hungary)","dataset","https://doi.org/10.57745/BV1AJA","doi:10.57745/BV1AJA","J2K_Fekete: J2000 hydrological model for the Fekete river basin (which includes the Bukkosdi sub-basin).","2025-02-26T17:33:10Z","DRYvER-WP1 Hydrological modelling catchment scale Europe","Mimeau, Louise; Branger, Flora; K&uuml;nne, Annika; Kralisch, Sven, 2025, ""J2000 Hydrological model of the Fekete-Bukkosdi river basin (Hungary)"", <a href=""https://doi.org/10.57745/BV1AJA"" target=""_blank"">https://doi.org/10.57745/BV1AJA</a>, Recherche Data Gouv, V2","DRYvER-WP1-DRN-EU","DRYvER-WP1 Hydrological modelling catchment scale Europe","Mimeau, Louise; Branger, Flora; Künne, Annika; Kralisch, Sven, 2025, ""J2000 Hydrological model of the Fekete-Bukkosdi river basin (Hungary)"", https://doi.org/10.57745/BV1AJA, Recherche Data Gouv, V2","inrae://10.57745/BV1AJA","hydrological model","Earth and Environmental Sciences",2,276819,"RELEASED",2,1,"2025-02-14T15:25:18Z","2025-03-31T13:57:16Z","Mimeau, Louise; INRAE, UR RiverLy, Villeurbanne, France","Mimeau, L., Künne, A., Branger, F., Kralisch, S., Devers, A., and Vidal, J.-P.: Flow intermittence prediction using a hybrid hydrological modelling approach: influence of observed intermittence data on the training of a random forest model, Hydrol. Earth Syst. Sci. 2024; Mimeau, L., Künne, A., Devers, A., Branger, F., Kralisch, S., Lauvernet, C., Vidal, J.-P., Bonada, N., Csabai, Z., Mykrä, H., Pařil, P., Polović, L., and Datry, T.: Projections of streamflow intermittence under climate change in European drying river networks, Hydrol. Earth Syst. Sci. 2025","DRYvER","Hungary; Bükkösdi catchment,","Mimeau, Louise; Branger, Flora; Künne, Annika; Kralisch, Sven","",35,29,1,1,26399240,0.025
"J2000 Hydrological model of the Ain-Albarine river basin (France)","dataset","https://doi.org/10.57745/II6DMA","doi:10.57745/II6DMA","J2K_Ain: J2000 hydrological model for the Ain river basin (which includes the Albarine sub-basin).","2025-02-26T17:31:27Z","DRYvER-WP1 Hydrological modelling catchment scale Europe","Mimeau, Louise; Branger, Flora; K&uuml;nne, Annika; Kralisch, Sven, 2025, ""J2000 Hydrological model of the Ain-Albarine river basin (France)"", <a href=""https://doi.org/10.57745/II6DMA"" target=""_blank"">https://doi.org/10.57745/II6DMA</a>, Recherche Data Gouv, V2","DRYvER-WP1-DRN-EU","DRYvER-WP1 Hydrological modelling catchment scale Europe","Mimeau, Louise; Branger, Flora; Künne, Annika; Kralisch, Sven, 2025, ""J2000 Hydrological model of the Ain-Albarine river basin (France)"", https://doi.org/10.57745/II6DMA, Recherche Data Gouv, V2","inrae://10.57745/II6DMA","hydrological model","Earth and Environmental Sciences",2,276820,"RELEASED",2,1,"2025-02-14T15:16:37Z","2025-03-31T13:58:35Z","Mimeau, Louise; INRAE, UR RiverLy, Villeurbanne, France","Mimeau, L., Künne, A., Branger, F., Kralisch, S., Devers, A., and Vidal, J.-P.: Flow intermittence prediction using a hybrid hydrological modelling approach: influence of observed intermittence data on the training of a random forest model, Hydrol. Earth Syst. Sci. 2024; Mimeau, L., Künne, A., Devers, A., Branger, F., Kralisch, S., Lauvernet, C., Vidal, J.-P., Bonada, N., Csabai, Z., Mykrä, H., Pařil, P., Polović, L., and Datry, T.: Projections of streamflow intermittence under climate change in European drying river networks, Hydrol. Earth Syst. Sci. 2025","DRYvER","France; Albarine catchment,","Mimeau, Louise; Branger, Flora; Künne, Annika; Kralisch, Sven","",39,32,1,1,58394095,0.054
