"name","type","url","dataset_DOI","description","published_at","publisher","citationHtml","identifier_of_dataverse","name_of_dataverse","citation","storageIdentifier","keywords","subjects","fileCount","versionId","versionState","majorVersion","minorVersion","createdAt","updatedAt","contacts","publications","producers","geographicCoverage","authors","dataSources","viewsTotal","viewsUnique","downloadsTotal","downloadsUnique","storage_size_bytes","storage_size_GB"
"Downscaled climate projections (1971-2100) for the Ain-Albarine river basin (France)","dataset","https://doi.org/10.57745/LXZVQV","doi:10.57745/LXZVQV","Downscaled projections of temperature, precipitation, and reference evapotranspiration for the Ain river basin (which includes the Albarine DRN). 3 SSP scenarios and 5 climate models.","2025-04-01T17:30:15Z","DRYvER-WP1 Hydrological modelling catchment scale Europe","Devers, Alexandre; Lauvernet, Claire; Vidal, Jean-Philippe, 2025, ""Downscaled climate projections (1971-2100) for the Ain-Albarine river basin (France)"", <a href=""https://doi.org/10.57745/LXZVQV"" target=""_blank"">https://doi.org/10.57745/LXZVQV</a>, Recherche Data Gouv, V2","DRYvER-WP1-DRN-EU","DRYvER-WP1 Hydrological modelling catchment scale Europe","Devers, Alexandre; Lauvernet, Claire; Vidal, Jean-Philippe, 2025, ""Downscaled climate projections (1971-2100) for the Ain-Albarine river basin (France)"", https://doi.org/10.57745/LXZVQV, Recherche Data Gouv, V2","inrae://10.57745/LXZVQV","spatial downscaling; climate change","Earth and Environmental Sciences",16,276882,"RELEASED",2,0,"2025-02-14T17:43:44Z","2025-04-01T17:30:15Z","Mimeau, Louise; INRAE, UR RiverLy, Villeurbanne, France","Mimeau, L., Künne, A., Devers, A., Branger, F., Kralisch, S., Lauvernet, C., Vidal, J.-P., Bonada, N., Csabai, Z., Mykrä, H., Pařil, P., Polović, L., and Datry, T.: Projections of streamflow intermittence under climate change in European drying river networks, Hydrol. Earth Syst. Sci. 2025; Devers, A., Lauvernet, C., and Vidal, J.-P.: DRYvER Deliverable D1.6 - Report on downscaling global climate projections for catchment scale hydrological modelling, Tech. rep., INRAE, 2023; https://www.dryver.eu/results/reports-and-documents","DRYvER","France; Albarine catchment,","Devers, Alexandre; Lauvernet, Claire; Vidal, Jean-Philippe","",18,17,1,1,1134102710,1.056
"Hydrological projections (1985-2100) of the Albarine DRN (France)","dataset","https://doi.org/10.57745/OJ2GO2","doi:10.57745/OJ2GO2","Hydrological model outputs at daily time step for the projection simulations (1985-2100) in the Albarine DRN (France). Simulated discharge, baseflow an state of flow (flowing/dry) is spatially distributed at the reach scale. Other hydroclimatic variables (temperature, precipitation, rainfall, snowfall, potential evapotranspiration, actual evapotranspiration, vegetation interception, snow water equivalent, saturation of the soil layer, saturation of the grounwater layer) are spatially aggregated at the catchment scale. Hydrological projections were produced for 3 SSP scenarios and 5 climate models.","2025-04-01T17:30:36Z","DRYvER-WP1 Hydrological modelling catchment scale Europe","Mimeau, Louise; K&uuml;nne, Annika; Devers, Alexandre; Branger, Flora; Kralisch, Sven; Lauvernet, Claire; Vidal, Jean-Philippe, 2025, ""Hydrological projections (1985-2100) of the Albarine DRN (France)"", <a href=""https://doi.org/10.57745/OJ2GO2"" target=""_blank"">https://doi.org/10.57745/OJ2GO2</a>, Recherche Data Gouv, V2","DRYvER-WP1-DRN-EU","DRYvER-WP1 Hydrological modelling catchment scale Europe","Mimeau, Louise; Künne, Annika; Devers, Alexandre; Branger, Flora; Kralisch, Sven; Lauvernet, Claire; Vidal, Jean-Philippe, 2025, ""Hydrological projections (1985-2100) of the Albarine DRN (France)"", https://doi.org/10.57745/OJ2GO2, Recherche Data Gouv, V2","inrae://10.57745/OJ2GO2","hydrological intermittence; climate change; hydrological simulations","Earth and Environmental Sciences",81,276890,"RELEASED",2,0,"2025-02-14T18:16:31Z","2025-04-01T17:30:36Z","Mimeau, Louise; INRAE, UR RiverLy, Villeurbanne, France","Mimeau, L., Künne, A., Branger, F., Kralisch, S., Devers, A., and Vidal, J.-P.: Flow intermittence prediction using a hybrid hydrological modelling approach: influence of observed intermittence data on the training of a random forest model, Hydrol. Earth Syst. Sci. 2024; Mimeau, L., Künne, A., Devers, A., Branger, F., Kralisch, S., Lauvernet, C., Vidal, J.-P., Bonada, N., Csabai, Z., Mykrä, H., Pařil, P., Polović, L., and Datry, T.: Projections of streamflow intermittence under climate change in European drying river networks, Hydrol. Earth Syst. Sci. 2025","DRYvER","France; Albarine catchment,","Mimeau, Louise; Künne, Annika; Devers, Alexandre; Branger, Flora; Kralisch, Sven; Lauvernet, Claire; Vidal, Jean-Philippe","",123,37,1,1,5281626223,4.919
"Hydrological projections (1985-2100) of the Genal DRN (Spain)","dataset","https://doi.org/10.57745/U6UZJP","doi:10.57745/U6UZJP","Hydrological model outputs at daily time step for the projection simulations (1985-2100) in the Genal DRN (Spain). Simulated discharge, baseflow an state of flow (flowing/dry) is spatially distributed at the reach scale. Other hydroclimatic variables (temperature, precipitation, rainfall, snowfall, potential evapotranspiration, actual evapotranspiration, vegetation interception, snow water equivalent, saturation of the soil layer, saturation of the grounwater layer) are spatially aggregated at the catchment scale. Hydrological projections were produced for 3 SSP scenarios and 5 climate models.","2025-04-01T17:30:58Z","DRYvER-WP1 Hydrological modelling catchment scale Europe","Mimeau, Louise; K&uuml;nne, Annika; Devers, Alexandre; Branger, Flora; Kralisch, Sven; Lauvernet, Claire; Vidal, Jean-Philippe, 2025, ""Hydrological projections (1985-2100) of the Genal DRN (Spain)"", <a href=""https://doi.org/10.57745/U6UZJP"" target=""_blank"">https://doi.org/10.57745/U6UZJP</a>, Recherche Data Gouv, V2","DRYvER-WP1-DRN-EU","DRYvER-WP1 Hydrological modelling catchment scale Europe","Mimeau, Louise; Künne, Annika; Devers, Alexandre; Branger, Flora; Kralisch, Sven; Lauvernet, Claire; Vidal, Jean-Philippe, 2025, ""Hydrological projections (1985-2100) of the Genal DRN (Spain)"", https://doi.org/10.57745/U6UZJP, Recherche Data Gouv, V2","inrae://10.57745/U6UZJP","hydrological intermittence; hydrological simulations; climate change","Earth and Environmental Sciences",81,276896,"RELEASED",2,0,"2025-02-14T18:22:43Z","2025-04-01T17:30:58Z","Mimeau, Louise; INRAE, UR RiverLy, Villeurbanne, France","Mimeau, L., Künne, A., Branger, F., Kralisch, S., Devers, A., and Vidal, J.-P.: Flow intermittence prediction using a hybrid hydrological modelling approach: influence of observed intermittence data on the training of a random forest model, Hydrol. Earth Syst. Sci. 2024; Mimeau, L., Künne, A., Devers, A., Branger, F., Kralisch, S., Lauvernet, C., Vidal, J.-P., Bonada, N., Csabai, Z., Mykrä, H., Pařil, P., Polović, L., and Datry, T.: Projections of streamflow intermittence under climate change in European drying river networks, Hydrol. Earth Syst. Sci. 2025","DRYvER","Spain; Genal catchment,","Mimeau, Louise; Künne, Annika; Devers, Alexandre; Branger, Flora; Kralisch, Sven; Lauvernet, Claire; Vidal, Jean-Philippe","",113,29,1,1,3762682663,3.504
"Hydrological projections (1985-2100) of the Butiznica DRN (Croatia)","dataset","https://doi.org/10.57745/BUPQQF","doi:10.57745/BUPQQF","Hydrological model outputs at daily time step for the projection simulations (1985-2100) in the Butiznica DRN (Croatia). Simulated discharge, baseflow an state of flow (flowing/dry) is spatially distributed at the reach scale. Other hydroclimatic variables (temperature, precipitation, rainfall, snowfall, potential evapotranspiration, actual evapotranspiration, vegetation interception, snow water equivalent, saturation of the soil layer, saturation of the grounwater layer) are spatially aggregated at the catchment scale. Hydrological projections were produced for 3 SSP scenarios and 5 climate models.","2025-04-01T17:30:49Z","DRYvER-WP1 Hydrological modelling catchment scale Europe","Mimeau, Louise; K&uuml;nne, Annika; Devers, Alexandre; Branger, Flora; Kralisch, Sven; Lauvernet, Claire; Vidal, Jean-Philippe, 2025, ""Hydrological projections (1985-2100) of the Butiznica DRN (Croatia)"", <a href=""https://doi.org/10.57745/BUPQQF"" target=""_blank"">https://doi.org/10.57745/BUPQQF</a>, Recherche Data Gouv, V2","DRYvER-WP1-DRN-EU","DRYvER-WP1 Hydrological modelling catchment scale Europe","Mimeau, Louise; Künne, Annika; Devers, Alexandre; Branger, Flora; Kralisch, Sven; Lauvernet, Claire; Vidal, Jean-Philippe, 2025, ""Hydrological projections (1985-2100) of the Butiznica DRN (Croatia)"", https://doi.org/10.57745/BUPQQF, Recherche Data Gouv, V2","inrae://10.57745/BUPQQF","hydrological intermittence; hydrological simulations; climate change","Earth and Environmental Sciences",81,276894,"RELEASED",2,0,"2025-02-14T18:20:55Z","2025-04-01T17:30:49Z","Mimeau, Louise; INRAE, UR RiverLy, Villeurbanne, France","Mimeau, L., Künne, A., Branger, F., Kralisch, S., Devers, A., and Vidal, J.-P.: Flow intermittence prediction using a hybrid hydrological modelling approach: influence of observed intermittence data on the training of a random forest model, Hydrol. Earth Syst. Sci. 2024; Mimeau, L., Künne, A., Devers, A., Branger, F., Kralisch, S., Lauvernet, C., Vidal, J.-P., Bonada, N., Csabai, Z., Mykrä, H., Pařil, P., Polović, L., and Datry, T.: Projections of streamflow intermittence under climate change in European drying river networks, Hydrol. Earth Syst. Sci. 2025","DRYvER","Croatia; Butiznica catchment,","Mimeau, Louise; Künne, Annika; Devers, Alexandre; Branger, Flora; Kralisch, Sven; Lauvernet, Claire; Vidal, Jean-Philippe","",123,38,2,2,6726746911,6.265
"Données principales de l'observatoire ORACLE","dataset","https://doi.org/10.17180/obs.oracle","doi:10.17180/obs.oracle","La base de données BDOH_ORACLE© met à disposition l'ensemble des chroniques produites et gérées par INRAE sur ORACLE, Observatoire de Recherche qui a pour objectif scientifique le fonctionnement et la modélisation hydrologique et biogéochimique des bassins sédimentaires à dominante rurale et fortement anthropisés sous climat océanique tempéré. Les approches développées sont caractéristiques du fonctionnement de ces milieux mais aussi des enjeux sociaux économiques importants liés à la dégradation de la qualité du milieu naturel et à la prévision et la prévention des risques hydrologiques (crues et étiages). Cette recherche passe par l'observation multi-variables et multi-échelles d'un ensemble de sous-bassins versants emboîtés (1 km² à 1 800 km²) du bassin parisien. Situé à 70 km à l'est de Paris, ORACLE est constitué par les bassins versants du Grand Morin et du Petit Morin et le bassin versant de l'Orgeval (sous-bassin du Grand Morin). L'ensemble des compartiments hydrologiques et hydriques d’ORACLE sont suivis via un réseau de mesure complet : stations limnimétriques à l'exutoire de chaque sous-bassin et dans le réseau de drainage, stations piézométriques, stations pluviométriques réparties sur l'ensemble d’ORACLE et stations d'humidité des sols en surface et en profondeur. Ce dispositif est doublé d'un réseau de mesure de la qualité des eaux de surface, de pluie et de la nappe, ainsi que d'une station météorologique complète. Sur le bassin versant de l’Orgeval (104 km²), les chroniques de débit et de qualité de l’eau sont disponibles respectivement depuis 1962 et 1978. L'antériorité de ces chroniques en fait un site d’exception et permet une approche statistique des phénomènes et des évolutions du paysage et du climat. Un réseau de mesures dit « de base » est maintenu en permanence sur l'observatoire ORACLE. Ces données sont acquises par la DRIEE Île-de-France, Météo-France et INRAE. Actuellement, seules les données gérées par INRAE sont accessibles via BD_OH. Météo-France (support.inspire@meteo.fr) et la DRIEE Île-de-France (hydro@developpement-durable.gouv.fr) doivent être directement contactés pour les observations complémentaires concernant l'observatoire ORACLE. Sites expérimentaux Bassin Versant de l'Orgeval L'Orgeval est un affluent du Grand Morin. Son bassin de 104 km² est instrumenté et géré par INRAE depuis 1962. Bassin versant du Grand Morin Le Grand Morin est l'un des principal affluent de la Marne. Son bassin (1190 km2) est instrumenté par la DRIEE Ile-de-France, Météo-France et INRAE. Bassin versant du Petit Morin Le Petit Morin est l'un des principal affluent de la Marne avec le Grand Morin. Son bassin de 622 km2 est instrumenté par la DRIEE Ile-de-France, Météo-France. Hors ORACLE Il existe deux stations d'humidité du sol en limite de l'observatoire géré par INRAE (Voulton-TDR et Suizy-TDR).","2024-11-22T12:36:21Z","BDOH","Tallec, Ga&euml;lle; Ansart, Patrick; Gu&eacute;rin, Alain; Delaigue, Olivier; Blanchouin, Arnaud, 2024, ""Donn&eacute;es principales de l'observatoire ORACLE"", <a href=""https://doi.org/10.17180/obs.oracle"" target=""_blank"">https://doi.org/10.17180/obs.oracle</a>, Recherche Data Gouv, V1","BDOH","BDOH","Tallec, Gaëlle; Ansart, Patrick; Guérin, Alain; Delaigue, Olivier; Blanchouin, Arnaud, 2024, ""Données principales de l'observatoire ORACLE"", https://doi.org/10.17180/obs.oracle, Recherche Data Gouv, V1","inrae://10.17180/obs.oracle","bassin versant expérimental; rural area; zone critique; hydrology; biogeochemistry; hydrogeology; meteorology; climatology","Earth and Environmental Sciences",0,273764,"RELEASED",1,0,"2024-10-16T16:52:34Z","2024-11-22T13:06:49Z","Support BDOH; INRAE","","Hydro science Montpellier; Institut de physique du globe de Paris; Observatoires de la zone critique : Applications et recherche; Programme interdisciplinaire de recherche sur l'eau et l'environnement du bassin de la Seine; Sorbonne Université; Institut national de recherche pour l'agriculture,l'alimentation et l'environnement; École nationale supérieure des mines de Paris; Fédération Île-de-France de recherche sur l’environnement; Météo-France","France; Grand Morin,; France; Petit Morin,","Tallec, Gaëlle; Ansart, Patrick; Guérin, Alain; Delaigue, Olivier; Blanchouin, Arnaud","",143,108,0,0,0,0
"OHM-CV mesures sur les Gardons","dataset","https://doi.org/10.17180/obs.ohm-cv.gardons","doi:10.17180/obs.ohm-cv.gardons","L'Observatoire Hydro-météorologique Méditerranéen Cévennes-Vivarais vise à fédérer les compétences de chercheurs de disciplines variées (météorologie, hydrologie, géophysique, géographie, mathématiques appliquées, socio-économie... ) pour améliorer les connaissances et les capacités de prévision du risque hydro-météorologique associé aux pluies intenses et aux crues éclairs. Plusieurs instituts et laboratoires contribuent à l'acquisition de données météorologiques et hydrologiques: La contribution de l'Irstea de Lyon consiste à mettre en service et assurer la maintenance et continuer le développement d'un réseau de stations de mesures sans contact du débit des rivières (mesure des vitesses de surface par la méthode LSPIV, et mesures de hauteur d'eau par capteur radar) sur le bassin versant de l'Ardèche. La contribution de l'Ecole des Mines d'Alès et de l'UMR Espace consiste à instrumenter et suivre plusieurs petits bassins versants cévenols: Valescure, Tourgueille, Avène (bassin du Gard), Cèze, Mont-Lozère (bassin du Tarn), et Basse Cévenne Calcaire. La contribution du LTHE concerne les bassins du Gazel et de la Claduègne (BV Ardèche), sur lesquels sont réalisés des suivis de hauteur limnimétrique, vitesse de surface, débit, turbidité, conductivité et température de l'eau. Sites expérimentaux Ardèche Mesures des débits de crue par analyse d'image sur le bassin versant de l'Ardèche Avène Bassins du piemont alésien : Avène amont : 2012-actuel -10 km2 -275-535 m alt.– géologie : houiller et calcaire (karst) – largement boisé (chêne vert) Avene aval : 2012-actuel –- 60 km2- 110-535 - géologie : dominante marno calcaire – espace agricole en voie d’urbanisation- Equipement : station non aménagée – 1 (2) limnigraphes – pluviographes à proximité : Les Mathieux (St julien les Rosiers) et St Christol-lez Alès Basse Cévenne Calcaire Système karstique du piémont alésien (une des têtes du bassin du Grabieux). 2011-actuel. alt. 200-356 m. géologie: calcaires jurassiques. végétation: boisement de chêne vert dominant exploité extensivement- 4 stations souterraines, 1 résurgence, 1 vallon sec. 1 pluviographe. mesures: niveau, (débit), pluie, température, conductivité Cèze Pas de description disponible Gazel - Claduègne Système d’observations hydrométéorologiques et hydro-sédimentaires centré sur trois bassins versants emboités : Gazel, Claduègne, Auzon (respectivement 3,4, 43, et 116 km²). Climat méditerranéen avec des précipitations et des crues éclairs en automne. La partie supérieure du bassin versant se caractérise par des formations volcaniques tandis que les deux tiers inférieurs sont constitués de roche calcaire sédimentaire. Les types de sols sont fortement influencés par la géologie du bassin versant. Les principaux types d’usage des sols sont les pâturages, les vignes et la forêt. Mont-Lozère BVRE de moyenne montagne sub mediterranéenne - flanc sud du Mont Lozère (1150-1500 m alt.) -granite- BV Cloutasses: lande à genêt pâturage ovin - 0.81 km2 BV Latte: forêt ONF -épicéa coupé en 1987-198 9 puis nouvelle plantation (résineux dominants) - 0.20 km2 BV Sapine: forêt PnC (hêtraie 80 %) - 0.54 km2 BV Alignon: composite - granite/schistes- 14.5 km2 (depuis 1997) BV Goudesche: forestier -11.7 km2 (voir station DREAL) -1997-2003 suivi depuis 1981 - chroniques Climato (P, T, insolation,...); pluviométrie (5 sites); débits: 5 stations hydro Tourgueille Bassins versants cévenols - Crebades : 2012-actuel – 1 km2- forestier (reboisement résineux dominant); Lieure (reboisement et terrasses abandonnées: 2012- actuel – 3 km2 ; Roumegous : 2012-actuel -10 km2 – composite . Equipement : stations naturelles sujettes à détarage important sur la Lieure et à Roumegous - 1 (2) limnigraphes ; 1 pluviographe (Tourgueille) Valescure Bassin versant représentatif des Cévennes,compris entre 230 et 815 m alt.: géologie: granite dominant, gneiss et schistes- boisé à 98 % (châtaigner: 50 %, chêne vert:42 %; résineux:5%)- aménagements anciens : terrasses, traversiers et tancats (ouvrages en pierres sèches barrant les thalwegs ayant fait l'objet de restauration entre 2002 et 2006). 5 BV étudiés : Valescure aval 2003-actuel 3.93 km2; Abrits: 2003-actuel -0.63 km2 - gneiss dominant et schistes - nombreux tancats; Cartaou : 2003-actuel - 0.52 km2 -gneiss et granite - référence (sans restauration)- châtaigneraie; Bastide: 2004-actuel -0.27 km2 -chênes verts et châtaigners; Valescure amont: 2005-actuel - 0.93 km2 -forestier; matériel géré par ESPACE: 5 limnigraphes - 2 pluviographes -1 station climatologique - 1 station TDR (2005-2010)","2024-11-22T12:36:15Z","BDOH","Didon-Lescot, Jean-Fran&ccedil;ois; Ayral, Pierre-Alain; Grard, Nadine, 2024, ""OHM-CV mesures sur les Gardons"", <a href=""https://doi.org/10.17180/obs.ohm-cv.gardons"" target=""_blank"">https://doi.org/10.17180/obs.ohm-cv.gardons</a>, Recherche Data Gouv, V1","BDOH","BDOH","Didon-Lescot, Jean-François; Ayral, Pierre-Alain; Grard, Nadine, 2024, ""OHM-CV mesures sur les Gardons"", https://doi.org/10.17180/obs.ohm-cv.gardons, Recherche Data Gouv, V1","inrae://10.17180/obs.ohm-cv.gardons","hydrology; bassin versant expérimental; flash flood; hydrometry","Earth and Environmental Sciences",0,273765,"RELEASED",1,0,"2024-10-16T16:53:30Z","2024-11-22T12:36:15Z","Support BDOH; INRAE","","Étude des Structures, des Processus d’Adaptation et des Changements de l’Espace; Institut national des sciences de l'Univers","France; Gard,; Bassin versant de l'Ardèche,; France; Ardèche,; Bassin versant de l'Ardèche,","Didon-Lescot, Jean-François; Ayral, Pierre-Alain; Grard, Nadine","",75,50,0,0,0,0
"Bassin versant expérimental du Réal Collobrier","dataset","https://doi.org/10.17180/obs.real","doi:10.17180/obs.real","Le bassin versant expérimental du Réal Collobrier est situé sur la façade méditerranéenne dans le département du Var, à l’extrémité Ouest du massif montagneux des Maures, à 20 km au Nord-est de Toulon. Avec 17 postes pluviographiques et 11 stations de contrôle de débits répartis sur 70 km2 il constitue un site repère de l’hydro-climatologie régionale depuis 1966. Sites expérimentaux Real Collobrier Le bassin versant expérimental du Réal Collobrier est situé sur la façade méditerranéenne dans le département du Var, à l’extrémité Ouest du massif montagneux des Maures, à 20 km au Nord-est de Toulon. Avec 17 postes pluviographiques et 11 stations de contrôle de débits répartis sur 70 km2 il constitue un site repère de l’hydro-climatologie régionale depuis 1966.","2024-11-22T12:36:03Z","BDOH","Tolsa, Mathieu; Folton, Nathalie; Arnaud, Patrick, 2024, ""Bassin versant exp&eacute;rimental du R&eacute;al Collobrier"", <a href=""https://doi.org/10.17180/obs.real"" target=""_blank"">https://doi.org/10.17180/obs.real</a>, Recherche Data Gouv, V1","BDOH","BDOH","Tolsa, Mathieu; Folton, Nathalie; Arnaud, Patrick, 2024, ""Bassin versant expérimental du Réal Collobrier"", https://doi.org/10.17180/obs.real, Recherche Data Gouv, V1","inrae://10.17180/obs.real","flash flood; hydrology","Earth and Environmental Sciences",0,273769,"RELEASED",1,0,"2024-10-17T08:27:47Z","2024-11-22T12:36:03Z","Support BDOH; INRAE","","Unité RECOVER","France; Var,; Bassin versant expérimental du Réal Collobrier,","Tolsa, Mathieu; Folton, Nathalie; Arnaud, Patrick","",46,42,0,0,0,0
