"dataset_DOI","url","name","citation","description","identifier_of_dataverse","subjects","keywords","fileCount","createdAt","authors","viewsTotal","viewsUnique","downloadsTotal","downloadsUnique","storage_size_bytes","storage_size_GB"
"doi:10.15454/HMTSXZ","https://doi.org/10.15454/HMTSXZ","Continuous measurement of the volumes discharged from three French single-family homes","Dubois, Vivien, 2021, ""Continuous measurement of the volumes discharged from three French single-family homes"", https://doi.org/10.15454/HMTSXZ, Recherche Data Gouv, V2, UNF:6:A56CA0L1LlcXeAQENpnWrg== [fileUNF]","The data consist of water heights, measured and recorded every minute, corresponding to the volumes of raw wastewater discharged from three French single-family homes (H1, H10 and H11), measured for durations ranging from 1 year, 8 months to 2 years, 2 months. A piezometer-type pressure sensor measured the water height at a pumping station, controlled by float switches. The effective surface area of the pump station was 0.44 m2 for the dwellings H1 and H10, and 0.28 m2 for H11. These water heights allow to calculate (after multiplication by the unit surface area) the flow rates expressed in volume per minute. Number of files: 16 for H1, 14 for H10 and 12 for H11 Variables: ""Start"": start date of measurement ""Date.H"": end date of measurement ""Status"": recording validation ""ANALOG-CH. (m)"": water height in metres In addition to the water level files, you will find files on the quality of the raw wastewater discharged by all the households monitored over several years and a comments file (""Comments.csv"") detailing the analytical standards used.","inrae","Earth and Environmental Sciences","",47,"2021-08-16T13:21:04Z","Dubois, Vivien",1474,404,415,22,NA,NA
"doi:10.57745/RMMZY7","https://doi.org/10.57745/RMMZY7","Dataset of an experiment and simulations of unsteady flows in a compound open channel","PROUST, SEBASTIEN, 2023, ""Dataset of an experiment and simulations of unsteady flows in a compound open channel"", https://doi.org/10.57745/RMMZY7, Recherche Data Gouv, V2, UNF:6:hBm/WuZ34CBBrYzNFjsmpA== [fileUNF]","This dataset includes both experimental measurements and numerical simulations of unsteady flows in a compound open-channel flume, consisting of a Main Channel (MC) and an adjacent Flood Plain (FP). The experimental data consist in: (i) water depths in MC and FP; (ii) inflow discharges in MC and FP; (iii) flow parameter at the vertical interface between MC and FP (lateral discharge, streamwise and spanwise mean velocities, and Reynolds stress). The numerical data (same flow parameters as the measured ones) stem from simulations using a 1D (one-dimensional) code that was adapted to implement the 1D+ Independent Sub-sections Model (ISM) (Proust et al. in Water Resour Res 45:1–16, 2009). Classical 1D data are also used as benchmark.","riverly","Earth and Environmental Sciences; Engineering; Physics","river dynamics; river flooding; transient flow; 1D model; floodplain; flood",42,"2023-09-05T16:21:07Z","PROUST, SEBASTIEN",254,125,79,7,22722149,0.021
"doi:10.57745/UHKSMA","https://doi.org/10.57745/UHKSMA","Characterising environmental contamination by plant protection products: bibliographic requests","MARGOUM, CHRISTELLE; BEDOS, CAROLE; MUNARON, DOMINIQUE; NELIEU, SYLVIE; ACHARD, ANNE-LAURE, 2024, ""Characterising environmental contamination by plant protection products: bibliographic requests"", https://doi.org/10.57745/UHKSMA, Recherche Data Gouv, V1","The combination of keywords and requests used to assess the contamination of all environmental compartments in France by PPPs as part of a Collective Scientific Assessment are detailed in the associated files.","riverly","Chemistry; Earth and Environmental Sciences","collective scientific assessment; pesticides; contamination; soil; freshwaters; seawaters; air",2,"2023-12-19T09:20:20Z","MARGOUM, CHRISTELLE; BEDOS, CAROLE; MUNARON, DOMINIQUE; NELIEU, SYLVIE; ACHARD, ANNE-LAURE",138,81,7,5,774785,0.001
"doi:10.57745/SGADUP","https://doi.org/10.57745/SGADUP","Supplementary information of the research paper Vergne et al. (2023)","Vergne, Adrien; Le Coz, Jérôme; Berni, Céline, 2023, ""Supplementary information of the research paper Vergne et al. (2023)"", https://doi.org/10.57745/SGADUP, Recherche Data Gouv, V1","Data and processing algorithms used in the research paper: ""Some backscatter modeling issues complicating the sonar-based monitoring of suspended sediments in rivers""","riverly","Earth and Environmental Sciences","",1,"2023-01-11T16:00:45Z","Vergne, Adrien; Le Coz, Jérôme; Berni, Céline",143,102,11,8,236866954,0.221
"doi:10.57745/NLFT7Q","https://doi.org/10.57745/NLFT7Q","Data set of solid gaugings in several rivers","Laible, Jessica; Dramais, Guillaume; Camenen, Benoît; Le Coz, Jérôme; Topping, David J.; Santini, William; Pierrefeu, Gilles, 2023, ""Data set of solid gaugings in several rivers"", https://doi.org/10.57745/NLFT7Q, Recherche Data Gouv, V1","Suspended sediment gaugings including concentration and ADCP data obtained on several rivers world wide and used for the research article: ""River suspended-sand discharge computation with uncertainty estimation, using water samples and high-resolution ADCP measurements""","riverly","Earth and Environmental Sciences","solid gauging; suspended sand; ADCP",9,"2023-04-20T09:35:12Z","Laible, Jessica; Dramais, Guillaume; Camenen, Benoît; Le Coz, Jérôme; Topping, David J.; Santini, William; Pierrefeu, Gilles",150,77,18,5,80863901,0.075
"doi:10.57745/ATSVJC","https://doi.org/10.57745/ATSVJC","SCOPE Hydro","Caillouet, Laurie; Vidal, Jean-Philippe; Sauquet, Eric; Devers, Alexandre; Graff, Benjamin, 2023, ""SCOPE Hydro"", https://doi.org/10.57745/ATSVJC, Recherche Data Gouv, V1","The hydrological reconstruction over France – called SCOPE Hydro (Spatially COherent Probabilistic Extension Hydro) – provides daily ensemble streamflow over 662 near-natural catchments of France over the 1871-2012 period. The SCOPE Hydro reconstruction originated from the GR6J model using the temperature, precipitation and evapotranspiration of the SCOPE Climate reconstruction as inputs.","riverly","Earth and Environmental Sciences","reconstruction, hydrology, france",5,"2023-02-01T09:31:13Z","Caillouet, Laurie; Vidal, Jean-Philippe; Sauquet, Eric; Devers, Alexandre; Graff, Benjamin",215,137,23,9,3704759056,3.45
"doi:10.57745/6VR1SR","https://doi.org/10.57745/6VR1SR","Safran Hydro","Caillouet, Laurie; Vidal, Jean-Philippe; Sauquet, Eric; Devers, Alexandre; Graff, Benjamin, 2023, ""Safran Hydro"", https://doi.org/10.57745/6VR1SR, Recherche Data Gouv, V1","The hydrological reconstruction over France – called Safran Hydro – provides daily derministic streamflow over 662 near-natural catchments of France over the 1 August 1958 to 31 July 2014 period. The Safran Hydro reconstruction originated from the GR6J model using the temperature, precipitation and evapotranspiration of the widely used Safran reanalysis as inputs.","riverly","Earth and Environmental Sciences","reconstruction, hydrology, france",5,"2023-02-01T09:34:24Z","Caillouet, Laurie; Vidal, Jean-Philippe; Sauquet, Eric; Devers, Alexandre; Graff, Benjamin",311,169,78,20,60282348,0.056
"doi:10.57745/IEQVN6","https://doi.org/10.57745/IEQVN6","Dataset of a laboratory experiment on the pollutant transport in a flooded street network under steady flow regime","FAGOUR, Clement; Mignot, Emmanuel; Proust, Sébastien, 2024, ""Dataset of a laboratory experiment on the pollutant transport in a flooded street network under steady flow regime"", https://doi.org/10.57745/IEQVN6, Recherche Data Gouv, V1, UNF:6:mGCKWUBrJyw1GeXA++VsYg== [fileUNF]","This dataset includes both measurements of velocity and concentration distributions, collected on a physical model. The 1:50 scale model in the horizontal plane, representing an urban area (one city block surrounded by four streets), is 5.4 m long and 3.8 m wide with a longitudinal slope (Sx = 0.12%). All the street cross-sections are rectangular (width b = 15 cm, and height of 15 cm). The experiments were performed under steady flow and pollutant release conditions. The total inlet discharge, Qi1+Qi2 = 6.5 l/s, was partitioned between the inflow in the Right street (Qi1 = 4.5 l/s) and Left street (Qi2 = 2.0 l/s). 1/ The experimental dataset for the pollutant consists in: (i) 4 time-averaged pollutant outflow discharges for 19 pollutant release locations; (ii) Time-averaged concentration distributions across the 5 sections S1 to S5 for one release location (""cu""); (iii) Transverse profiles of the depth and time averaged concentration for the release locations ""cu"", ""lu"", ""ru"" across S1 and for ""cu' "" across S6. (iv) Time-averaged concentration distribution across S1 for ""cu"" in a straight single street. 2/ The experimental velocity dataset consists in: (i) Time-averaged streamwise velocity distributions across S1 to S5. The distributions of the time-averaged transverse and vertical velocities, and the transverse Reynolds shear stress are only available for sections S3 to S5. (ii) Time-averaged surface velocities within the 4 intersections.","riverly","Earth and Environmental Sciences; Physics","Urban flooding; Pollution; Mixing; Dispersion; Concentration; Intersections",18,"2024-07-15T12:23:51Z","FAGOUR, Clement; Mignot, Emmanuel; Proust, Sébastien",82,48,2,1,269605001,0.251
"doi:10.57745/EKCG4J","https://doi.org/10.57745/EKCG4J","Data used for the research paper Laible et al. (2023)","Laible, Jessica; Camenen, Benoît; Le Coz, Jérôme; Pierrefeu, Gilles; Mourier, Brice; Lauters, François; Dramais, Guillaume, 2023, ""Data used for the research paper Laible et al. (2023)"", https://doi.org/10.57745/EKCG4J, Recherche Data Gouv, V1","Data used in the research paper: ""Comparison of grain size distribution measurements of sand‑silt mixtures using laser diffraction systems""","riverly","Earth and Environmental Sciences","",12,"2023-03-06T08:09:30Z","Laible, Jessica; Camenen, Benoît; Le Coz, Jérôme; Pierrefeu, Gilles; Mourier, Brice; Lauters, François; Dramais, Guillaume",192,112,28,6,411492,0
"doi:10.57745/MYYIIM","https://doi.org/10.57745/MYYIIM","Dataset associated to ""Caged Gammarus fossarum (Crustacea) for the assessment of bioavailable contamination levels in continental waters: a national deployment""","RECOURA-MASSAQUANT, REMI, 2024, ""Dataset associated to ""Caged Gammarus fossarum (Crustacea) for the assessment of bioavailable contamination levels in continental waters: a national deployment"""", https://doi.org/10.57745/MYYIIM, Recherche Data Gouv, V1","The dataset comprises bioavailable chemical contamination data (bioaccumulated contamination levels measured in caged Gammarus fossarum), resulting from biomonitoring survey acquired from French water agencies in 2019. These data were used in the research paper :""Caged Gammarus fossarum (Crustacea) for the assessment of bioavailable contamination levels in continental waters: a national deployment.""","riverly","Earth and Environmental Sciences","Gammarus; Active biomonitoring; chemical contamination",2,"2024-07-04T15:02:18Z","RECOURA-MASSAQUANT, REMI",16,12,0,0,537400,0.001
"doi:10.57745/TCE1KI","https://doi.org/10.57745/TCE1KI","Hydroperiod is a key driver of alpine pond communities along an altitudinal gradient in the French Alps and Pyrenees","Lamouille-Hébert, Marie; Arthaud, Florent; Besnard, Aurélien; Logez, Maxime; Datry, Thibault, 2024, ""Hydroperiod is a key driver of alpine pond communities along an altitudinal gradient in the French Alps and Pyrenees"", https://doi.org/10.57745/TCE1KI, Recherche Data Gouv, V1","Data repository for ‘Hydroperiod is a key driver of alpine pond communities along an altitudinal gradient in the French Alps and Pyrenees’ (in prep) Abstract: alpine pond species are particularly vulnerable to the effects of climate change, such as warming, drying and isolation. While the role of temperature and hydroperiod in structuring communities along an altitudinal gradient has been demonstrated in alpine lakes or rivers, very few studies have been conducted in alpine ponds, and the role of hydroperiod is actively debated. To understand which environmental factors structure alpine pond communities, we investigated the relationship between three biotic groups (Odonata, Amphibia and macrophytes) and their environment in 500 ponds in the French Alps and Pyrenees. As predicted, most communities varied along an altitudinal gradient, though not uniformly within the alpine biogeographic region. We also showed that hydroperiod is a key determinant of community variation in alpine ponds common to all geographic zones in the alpine biogeographic area. Finally, we demonstrated that connectivity between ponds should be maintained to conserve alpine specialist communities and mediate the effects of temperature and hydroperiod in the context of climate change. In order to design effective conservation measures for alpine pond communities, further research is needed on the drought resistance of non-permanent pond communities and on the connectivity between alpine ponds.","riverly","Earth and Environmental Sciences","biodiversity; macrophytes; Amphibia; Odonata; climate change; freshwater",31,"2024-12-14T17:24:55Z","Lamouille-Hébert, Marie; Arthaud, Florent; Besnard, Aurélien; Logez, Maxime; Datry, Thibault",103,34,35,3,26421115,0.025
"doi:10.57745/KRY5DX","https://doi.org/10.57745/KRY5DX","Hydroacoustic amplitude and velocity data","Marggraf, Jessica; Le Coz, Jérôme; Camenen, Benoît; Lauters, Francois; Dramais, Guillaume; Pierrefeu, Gilles; Topping, David, 2024, ""Hydroacoustic amplitude and velocity data"", https://doi.org/10.57745/KRY5DX, Recherche Data Gouv, V1","Continuous hydroacoustic amplitude and velocity measurements from April 2021 to June 2023 in the Isère River at Grenoble Campus, France","riverly","Earth and Environmental Sciences","",21,"2024-03-07T14:25:06Z","Marggraf, Jessica; Le Coz, Jérôme; Camenen, Benoît; Lauters, Francois; Dramais, Guillaume; Pierrefeu, Gilles; Topping, David",107,92,0,0,1285487661,1.197
"doi:10.57745/4HK78J","https://doi.org/10.57745/4HK78J","HydRE","Devers, Alexandre; Vidal, Jean-Philippe; Lauvernet, Claire; Vannier, Olivier, 2023, ""HydRE"", https://doi.org/10.57745/4HK78J, Recherche Data Gouv, V1","The hydrological reconstruction over France – called HydRE (Hydrological REconstructions) – provides daily ensemble streamflow over 661 near-natural catchments of France over the 1871-2012 period. The HydRE reconstruction originated from the GR6J model using the temperature and precipitation of FYRE Climate reanalysis and evapotranspiration of the SCOPE Climate reconstruction as inputs.","riverly","Earth and Environmental Sciences","",5,"2023-02-01T09:36:48Z","Devers, Alexandre; Vidal, Jean-Philippe; Lauvernet, Claire; Vannier, Olivier",216,130,46,11,3704759056,3.45
"doi:10.57745/SQGD3U","https://doi.org/10.57745/SQGD3U","171 ADCP gaugings from 45 teams during the Sault-Brénaz regatta (France, November 2023)","Groupe Doppler Hydrométrie; Blaise Calmel; Jérôme Le Coz; Aurélien Despax; Alexandre Hauet, 2024, ""171 ADCP gaugings from 45 teams during the Sault-Brénaz regatta (France, November 2023)"", https://doi.org/10.57745/SQGD3U, Recherche Data Gouv, V1","The moving-boat ADCP regatta organized by Groupe Doppler Hydrométrie on November 15, 2023 attracted over 130 participants. They were divided in 45 teams from various European countries (Germany, France, Great Britain, Luxembourg, Poland, Slovakia, Sweden, Czech Republic). This intercomparison enabled 57 ADCP to be tested on a straight channel near the Rhône at Sault-Brénaz. They carried out nearly 170 ADCP gaugings over the course of four sessions spread throughout the day: two in the morning (S1a and S1b) and two in the afternoon (S2a and S2b). Mean measured discharge was 2.1 m3/s for a velocity close to 40 cm/s. The Sault-Brénaz canal is 8 meters wide and almost a meter deep, with little vegetation, clear water and a steady flow, providing favorable conditions for ADCP measurements. Teams were advised to post-process their measurements with QRevInt 1.18. Users were free to select settings that seemed appropriate to them (navigation reference bottom track or GPS, extrapolation method/exponent, distance to the banks). This experiment allows to test the proper calibration of ADCPs and also to identify sources of error in these measurement conditions. Data is divided into 4 folders corresponding to the sessions. Subfolders are named according to the convention Session_Team_Section_Model of each ADCP measurement. Each sub-folder corresponds to a team measurement during a session and contains ADCP raw data. File extension is *.mmt for Teledyne RD instruments and *.mat for Xylem - SonTek instruments. Raw ADCP file can be opened with QRevInt software (https://www.genesishydrotech.com/qrevint). ADCP dataset can be processed with QRame software (https://gdh-hydrometrie.org/boite-a-outils/logiciels/qrame-2/)","riverly","Earth and Environmental Sciences","Hydrometry",1,"2024-04-03T12:40:22Z","Groupe Doppler Hydrométrie; Blaise Calmel; Jérôme Le Coz; Aurélien Despax; Alexandre Hauet",197,96,26,22,1720719525,1.603
"doi:10.57745/YJPBUF","https://doi.org/10.57745/YJPBUF","Hydrological monitoring of a Sewer Overflow Device in Grézieu-la-Varenne (since 1997).","Lagouy, Mickaël; Breil, Pascal; Branger, Flora, 2022, ""Hydrological monitoring of a Sewer Overflow Device in Grézieu-la-Varenne (since 1997)."", https://doi.org/10.57745/YJPBUF, Recherche Data Gouv, V1","Continuous monitoring of the sewer overflow device in Grézieu La Varenne on the Chaudanne river, as part of the Field Observatory for Urban Water Management (OTHU). Monitoring of the discharge in the sewer overflow device, in the Chaudanne river upstream and downstream of the SOD, and in the sewer network.","riverly","Earth and Environmental Sciences","sewer overflow; urban hydrology; hydrology",0,"2022-10-07T20:02:59Z","Lagouy, Mickaël; Breil, Pascal; Branger, Flora",107,85,0,0,0,0
"doi:10.57745/VVQ2X9","https://doi.org/10.57745/VVQ2X9","Rainfall monitoring on the Yzeron catchment since 1997","Lagouy, Mickaël; Branger, Flora; Breil, Pascal, 2022, ""Rainfall monitoring on the Yzeron catchment since 1997"", https://doi.org/10.57745/VVQ2X9, Recherche Data Gouv, V1","Continuous monitoring of meteorological data (rainfall, air temperature, additional variables) on the Yzeron catchment since 1997, as part of the Field Observatory for Urban Water Management","riverly","Earth and Environmental Sciences","urban hydrology; peri-urban areas; hydrology; bassin versant experimental",0,"2022-10-07T19:51:55Z","Lagouy, Mickaël; Branger, Flora; Breil, Pascal",109,82,0,0,0,0
"doi:10.57745/LNBEGZ","https://doi.org/10.57745/LNBEGZ","MAKAHO : Analyse de tendances hydrologiques du RRSE","HERAUT, Louis; LANG, Michel; RENARD, Benjamin; SAUQUET, Eric; VIDAL, Jean-Philippe, 2024, ""MAKAHO : Analyse de tendances hydrologiques du RRSE"", https://doi.org/10.57745/LNBEGZ, Recherche Data Gouv, V3, UNF:6:AVc3GLx35yMuQgsk7swZGA== [fileUNF]","MAKAHO (pour MAnn-Kendall Analysis of Hydrological Observations) est un système de visualisation cartographique interactif permettant de calculer les tendances présentes dans les données des stations hydrométriques aux débits peu influencés par les actions humaines. Le test de Mann-Kendall permet d’analyser la significativité des tendances de variables hydrologiques sur les différentes composantes du régime des cours d'eau (étiages, moyennes-eaux, crues), à mettre ensuite en relation avec les impacts du changement climatique sur l’hydrologie de surface. Le jeu de donnée présenté ici correspond à un échantillon représentatif de ce que peut produire MAKAHO sur la période 1968 - 2020. MAKAHO (for MAnn-Kendall Analysis of Hydrological Observations) is an interactive cartographic visualization system designed to calculate trends present in data from streamflow gauging stations with minimal human influence. The Mann-Kendall test is used to analyze the significance of trends in hydrological variables across different components of streamflow regimes (low flows, mean flows, high flows), which are then related to the impacts of climate change on surface hydrology. The dataset presented here is a representative sample of what MAKAHO can produce on the period 1968 - 2020.","riverly","Earth and Environmental Sciences","analyse de tendance; hydrologie de surface; changement climatique; étiage; régime de crue; disponibilité en eau; test de Mann-Kendall; RRSE",69,"2024-05-19T03:11:36Z","HERAUT, Louis; LANG, Michel; RENARD, Benjamin; SAUQUET, Eric; VIDAL, Jean-Philippe",608,253,157,11,303970663,0.283
"doi:10.57745/YTCYSX","https://doi.org/10.57745/YTCYSX","Suspended sediment measurements in the Isère River at Grenoble Campus","Marggraf, Jessica; Camenen, Benoît; Le Coz, Jérôme; Dramais, Guillaume; Lauters, François; Pierrefeu, Gilles, 2023, ""Suspended sediment measurements in the Isère River at Grenoble Campus"", https://doi.org/10.57745/YTCYSX, Recherche Data Gouv, V1","Suspended sediment measurements, including information on sand and fine sediment concentration and grain size, ADCP and bedload measurements","riverly","Earth and Environmental Sciences","Suspended sediment; Suspended sand; Sand; River; ADCP",139,"2023-08-31T13:14:54Z","Marggraf, Jessica; Camenen, Benoît; Le Coz, Jérôme; Dramais, Guillaume; Lauters, François; Pierrefeu, Gilles",792,179,569,5,275319785,0.256
"doi:10.57745/5TDKA4","https://doi.org/10.57745/5TDKA4","Transcriptome assembly, open reading frames (ORF) predictions  and protein catalogues of two aquatic sentinel species : Palaemon serratus and Dreissena polymorpha","DEGLI ESPOSTI, DAVIDE; LEPRÊTRE, MAXIME; SUGIER, KEVIN; XUEREB, BENOÎT; GEFFARD, ALAIN; PALOS-LADEIRO, MELISSA; GEFFARD, OLIVIER; CHAUMOT, ARNAUD, 2023, ""Transcriptome assembly, open reading frames (ORF) predictions and protein catalogues of two aquatic sentinel species : Palaemon serratus and Dreissena polymorpha"", https://doi.org/10.57745/5TDKA4, Recherche Data Gouv, V2, UNF:6:o4tYRQ2HbmsLY+L0FVBRLg== [fileUNF]","This dataset comprises RNA sequences from two well-established aquatic sentinel species, Dreissena polymorpha (a mollusk bivalve) and Palaemon serratus (a crustacean decapod), which are commonly used as bioindicators of environmental health. In addition, the dataset included the prediction of open reading frames (ORFs) of these reference transcriptomes, which can aid in the interpretation of mass spectra during proteogenomic analyses.","riverly","Earth and Environmental Sciences; Medicine, Health and Life Sciences","Sentinel Species; Ecotoxicology; Transcriptomes; Protein predictions",8,"2023-03-09T11:32:35Z","DEGLI ESPOSTI, DAVIDE; LEPRÊTRE, MAXIME; SUGIER, KEVIN; XUEREB, BENOÎT; GEFFARD, ALAIN; PALOS-LADEIRO, MELISSA; GEFFARD, OLIVIER; CHAUMOT, ARNAUD",242,127,3,3,1094430305,1.019
