"dataset_DOI","url","name","citation","description","identifier_of_dataverse","subjects","keywords","fileCount","createdAt","authors","viewsTotal","viewsUnique","downloadsTotal","downloadsUnique","storage_size_bytes","storage_size_GB"
"doi:10.57745/JJWOYS","https://doi.org/10.57745/JJWOYS","Explore2 dataset : A large transient multi-scenario multi-model ensemble of future streamflows and groundwater projections in France","Sauquet, Éric; Evin, Guillaume; Aissat, Ryma; Arnaud, Patrick; Bonneau, Jérémie; Branger, Flora; Caballero, Yvan; Colléoni, François; Ducharne, Agnès; Gailhard, Joël; Habets, Florence; Hendrickx, Frédéric; Héraut, Louis; Hingray, Benoît; Huang, Peng; Jaouen, Tristan; Jeantet, Alexis; Lanini, Sandra; Le Lay, Mathieu; Mimeau, Louise; Monteil, Céline; Munier, Simon; Perrin, Charles; Robelin, Olivier; Rousset, Fabienne; Soubeyroux, Jean-Michel; Strohmenger, Laurent; Thirel, Guillaume; Tocquer, Flore; Tramblay, Yves; Vergnes, Jean-Pierre; Vidal, Jean-Philippe, 2024, ""Explore2 dataset : A large transient multi-scenario multi-model ensemble of future streamflows and groundwater projections in France"", https://doi.org/10.57745/JJWOYS, Recherche Data Gouv, V1, UNF:6:+JYBRCIFEu698fD54YY+1Q== [fileUNF]","A large transient multi-scenario and multi-model ensemble of future streamflows and groundwater projections in France developed in a national project named Explore2 was recently published. The main objective of Explore2 is to provide rich and spatially consistent information for the future evolution of hydrological (surface and groundwater) resources and extremes in France to support adaptation strategies. The Explore2 dataset was obtained using a nested multi-scenario multi-model approach to estimate future uncertainty and to access local climate and catchment scales: 3 greenhouse gases (GHG) emission scenarios, with a set of 17 combinations of Global Climate Models and Regional Climate Models (GCM-RCM) and 2 bias correction methods provide the meteorological forcings for 9 surface hydrology models and 4 groundwater hydrology models (1 to simulate groundwater recharge and 3 to simulate groundwater level). The associated datapaper, present the methodology underlying the dataset, the assessment of the hydrological models we applied against daily observations of discharge and groundwater level, the data availability and the ways of accessing the data and understanding the results (mainly through visualisation tools).","explore2","Earth and Environmental Sciences","hydrological projection; hydrogeological projection; hydrological modelling; climate change; climate change mitigation; climate change adaptation; river flow; groundwater level",5,"2024-11-06T16:57:57Z","Sauquet, Éric; Evin, Guillaume; Aissat, Ryma; Arnaud, Patrick; Bonneau, Jérémie; Branger, Flora; Caballero, Yvan; Colléoni, François; Ducharne, Agnès; Gailhard, Joël; Habets, Florence; Hendrickx, Frédéric; Héraut, Louis; Hingray, Benoît; Huang, Peng; Jaouen, Tristan; Jeantet, Alexis; Lanini, Sandra; Le Lay, Mathieu; Mimeau, Louise; Monteil, Céline; Munier, Simon; Perrin, Charles; Robelin, Olivier; Rousset, Fabienne; Soubeyroux, Jean-Michel; Strohmenger, Laurent; Thirel, Guillaume; Tocquer, Flore; Tramblay, Yves; Vergnes, Jean-Pierre; Vidal, Jean-Philippe",113,46,27,7,1306839,0.001
"doi:10.57745/ZXR4PS","https://doi.org/10.57745/ZXR4PS","Projections hydrologiques souterraines sur le domaine de la plateforme aquifr – Nord Pas-De-Calais, Basse-Normandie, Bassin parisien, Loire, Poitou-Charentes, Alsace, Tarn-Et-Garonne","Jeantet, Alexis; Vergnes, Jean-Pierre; Munier, Simon; Habets, Florence, 2024, ""Projections hydrologiques souterraines sur le domaine de la plateforme aquifr – Nord Pas-De-Calais, Basse-Normandie, Bassin parisien, Loire, Poitou-Charentes, Alsace, Tarn-Et-Garonne"", https://doi.org/10.57745/ZXR4PS, Recherche Data Gouv, V1","Dans un contexte de stress hydrique croissant face au changement climatique en cours, l’évaluation de l’évolution de la ressource en eaux souterraines est devenue de nos jours un enjeu majeur pour les gestionnaires de l’eau. Ce rapport vise à évaluer les impacts du changement climatique sur les eaux souterraines de la France métropolitaine au cours du XXIe siècle. Le domaine spatial traité avec la plateforme AquiFR se situe majoritairement dans le nord de la France le long de la ligne reliant la Vendée, la Bretagne et le Bassin parisien, jusqu'à la région Nord Pas-de-Calais (nouvellement Hauts-de-France). Deux applications sont situées couvrant deux zones d'environ 1000 km2 au nord de Mulhouse et en Tarn-et-Garonne.","explore2","Earth and Environmental Sciences","modélisation; hydrogéologie; AquiFR; impact du changement climatique; SPLI",1,"2024-06-23T11:35:07Z","Jeantet, Alexis; Vergnes, Jean-Pierre; Munier, Simon; Habets, Florence",299,116,83,71,7065157,0.007
"doi:10.57745/ZQPNIE","https://doi.org/10.57745/ZQPNIE","Projections hydrologiques : Recharge potentielle des aquifères","Lanini, Sandra; Robelin, Olivier; Caballero, Yvan; Sauquet, Éric, 2024, ""Projections hydrologiques : Recharge potentielle des aquifères"", https://doi.org/10.57745/ZQPNIE, Recherche Data Gouv, V1","Ce rapport présente les projections de recharge potentielle des aquifères par infiltration des précipitations efficaces obtenues en mettant en œuvre le modèle RECHARGE sur l’ensemble du territoire hexagonal avec, pour données d’entrée, les évolutions climatiques projetées par l’ensemble élaboré et corrigées avec la méthode ADAMONT dans le cadre du projet Explore2.","explore2","Earth and Environmental Sciences","climat; modélisation; pluie efficace; infiltration; recharge de la nappe; aquifère",1,"2024-06-23T15:46:12Z","Lanini, Sandra; Robelin, Olivier; Caballero, Yvan; Sauquet, Éric",381,136,93,79,5972296,0.006
"doi:10.57745/JUPE21","https://doi.org/10.57745/JUPE21","Accompagnement de lecture des fiches Incertitudes","Évin, Guillaume, 2024, ""Accompagnement de lecture des fiches Incertitudes"", https://doi.org/10.57745/JUPE21, Recherche Data Gouv, V1","Ce document a pour objectif d’accompagner la lecture des fiches incertitudes produites avec l’ensemble de projections hydroclimatiques d’Explore2 obtenus avec la méthode de correction ADAMONT. Le lecteur pourra consulter le rapport Explore2 dédié aux incertitudes pour des informations complémentaires (Evin et al., 2024) ainsi que les notices de lecture des illustrations produites (Reverdy et al., 2023a,b).","explore2","Earth and Environmental Sciences","",1,"2024-06-23T14:20:00Z","Évin, Guillaume",229,84,46,41,924127,0.001
"doi:10.57745/ZF6RXA","https://doi.org/10.57745/ZF6RXA","Projections hydrologiques souterraines en région Bretagne : Résultats du modèle EROS-Bretagne","Vergnes, Jean-Pierre; Amraoui, Nadia; Tricoire, Loriana, 2024, ""Projections hydrologiques souterraines en région Bretagne : Résultats du modèle EROS-Bretagne"", https://doi.org/10.57745/ZF6RXA, Recherche Data Gouv, V1","Le modèle EROS-Bretagne simule les débits en rivière au droit de 96 stations hydrométriques et les niveaux de nappe au droit de 41 piézomètres à l’échelle de la Bretagne. Les indicateurs utilisés pour évaluer l’impact du changement climatique sur l’évolution des niveaux de nappe se basent sur le calcul de niveaux piézométriques moyens annuels et saisonniers, sur le calcul de tendances à long termes, et enfin sur l’occurrence d’évènements extrêmes. Les impacts sont déterminés en agrégeant ces indicateurs sur des périodes de 30 ans et en comparant trois horizons temporels futurs (2021-2050, 2041-2070 et 2070-2099) à une période de référence historique (1976-2005).","explore2","Earth and Environmental Sciences","hydrologie; modélisation; niveaux piézométriques; climat; Bretagne",1,"2024-06-26T16:44:07Z","Vergnes, Jean-Pierre; Amraoui, Nadia; Tricoire, Loriana",136,62,27,25,6325739,0.006
"doi:10.57745/3KWMMY","https://doi.org/10.57745/3KWMMY","Projections hydrologiques souterraines sur le territoire nord-aquitain","Vergnes, Jean-Pierre; Mertz, Samuel; Aissat, Ryma; Amraoui, Nadia, 2024, ""Projections hydrologiques souterraines sur le territoire nord-aquitain"", https://doi.org/10.57745/3KWMMY, Recherche Data Gouv, V1","Le MOdèle Nord-Aquitain (MONA) simule l’évolution des niveaux de nappe à l’échelle des aquifères du territoire Nord-Aquitain. C’est un modèle spatialisé à une résolution de 2 km et discrétisé sur la verticale en 15 couches représentant les principaux aquifères de ce système multicouche. Ce modèle simule l’évolution des nappes profondes sous couverture, dites captives, au pas de temps annuel. Les indicateurs utilisés pour évaluer l’impact du changement climatique sur l’évolution de ces nappes se basent sur les niveaux piézométriques annuels calculés par le MONA. Les impacts sont déterminés en agrégeant ces indicateurs sur des périodes de 30 ans et en comparant trois horizons temporels futurs (2021-2050, 2041-2070 et 2070-2099) à une période de référence (1976-2005).","explore2","Earth and Environmental Sciences","hydrologie; modélisation; niveaux piézométriques; climat; Nord-Aquitaine",1,"2024-06-26T16:52:39Z","Vergnes, Jean-Pierre; Mertz, Samuel; Aissat, Ryma; Amraoui, Nadia",148,64,32,28,8533755,0.008
"doi:10.57745/KXRB5B","https://doi.org/10.57745/KXRB5B","Projections climatiques régionalisées : correction de biais et changements futurs","Robin, Yoann; Corre, Lola; Marson, Paola; Bernus, Sébastien; Vrac, Mathieu; Thao, Soulivanh, 2024, ""Projections climatiques régionalisées : correction de biais et changements futurs"", https://doi.org/10.57745/KXRB5B, Recherche Data Gouv, V1","Le volet climat d’Explore2 a pour objectif de produire, évaluer et analyser des données atmosphériques à haute résolution, corrigées de leurs biais, qui couvrent la période historique et les décennies futures jusqu’en 2100. Celles‐ci ont vocation à alimenter des projections hydro‐climatiques. Le rapport présente les méthodes appliquées pour l'élaboration de ces données.","explore2","Earth and Environmental Sciences","climat régional; projection; correction de biais; hydrologie",2,"2024-05-31T16:56:06Z","Robin, Yoann; Corre, Lola; Marson, Paola; Bernus, Sébastien; Vrac, Mathieu; Thao, Soulivanh",400,139,111,59,37472444,0.035
"doi:10.57745/NU9MZI","https://doi.org/10.57745/NU9MZI","Notice de presentation des projections et incertitudes","Reverdy, Alix; Évin, Guillaume; Hingray, Benoît, 2024, ""Notice de presentation des projections et incertitudes"", https://doi.org/10.57745/NU9MZI, Recherche Data Gouv, V1","Ce document a pour objectif d’exposer les concepts des analyses d’incertitudes faites avec l’ensemble de projections hydroclimatiques d’Explore2 et d’illustrer les représentations graphiques qui seront produites pour caractériser l’évolution future de différents indicateurs hydroclimatiques telle que projetée dans cet ensemble. La méthode d’analyse fait appel à des méthodes statistiques avancées, qui permettent de produire différents types de résultats et de représentations graphiques.","explore2","Earth and Environmental Sciences","",2,"2024-05-31T15:09:32Z","Reverdy, Alix; Évin, Guillaume; Hingray, Benoît",237,89,71,37,3767346,0.004
"doi:10.57745/TLUTKF","https://doi.org/10.57745/TLUTKF","Quelles évolutions des régimes hydrologiques en France hexagonale ?","Sauquet, Éric; Strohmenger, Laurent; Thirel, Guillaume; Le Lay, Matthieu, 2024, ""Quelles évolutions des régimes hydrologiques en France hexagonale ?"", https://doi.org/10.57745/TLUTKF, Recherche Data Gouv, V3","Ce rapport est une des synthèses des résultats obtenus pour l’hydrologie de surface. Il fait suite aux rapport sur l’évolution du climat et sur la recharge potentielle des aquifères, et est centré sur les variables descriptives du régime hydrologique, c’est-à-dire sur la répartition au cours de l’année des débits et sur le débit annuel. Ce rapport vient compléter les deux rapports qui examinent les débits futurs : celui dédié à l’analyse des événements extrêmes et celui qui examine les incertitudes présentes dans les projections qu’elles soient climatiques ou hydrologiques. Des renvois à ces deux rapports ont été signalés autant que nécessaire dans les sections qui suivent.","explore2","Earth and Environmental Sciences","modélisation hydrologique; débits mensuels; régime hydrologique; classification de Pardé",1,"2024-06-20T08:10:31Z","Sauquet, Éric; Strohmenger, Laurent; Thirel, Guillaume; Le Lay, Matthieu",997,288,215,156,56560607,0.053
"doi:10.57745/KWH320","https://doi.org/10.57745/KWH320","Ensemble de projections Explore2 : Changements moyens et incertitudes associées","Évin, Guillaume; Hingray, Benoît; Reverdy, Alix; Ducharne, Agnès; Sauquet, Éric, 2024, ""Ensemble de projections Explore2 : Changements moyens et incertitudes associées"", https://doi.org/10.57745/KWH320, Recherche Data Gouv, V2","Le projet Explore2 a produit un large ensemble de projections hydroclimatiques multi-scénarios et multi-modèles pour la France métropolitaine (appelé par la suite ensemble Explore2) sur la base des projections climatiques régionales du programme international EURO-CORDEX. Cet ensemble a été obtenu avec 3 scénarios d’émission de gaz à effet de serre (scénarios RCP2.6, RCP4.5 et RCP8.5), 17 chaînes de modélisation climatiques, 2 modèles de correction de biais et 4 à 9 modèles hydrologiques (jusqu’à 648 projections). Les projections climatiques au sens large sont, pour la majeure partie des variables hydrométéorologiques, fortement incertaines. Ces incertitudes résultent de différents types d’incertitudes qui se propagent et s’amplifient dans la chaîne de modélisation : les incertitudes liées au choix du scénario d’émission, les incertitudes liées aux modélisations (au Modèle de Climat Global GCM, au Modèle de Climat Régional RCM, au Modèle de Correction de biais BC, au Modèle Hydrologique HM) et les incertitudes liées à la variabilité interne du climat. Les objectifs du présent rapport sont : de présenter les différentes sources d’incertitude associées à l’ensemble Explore2, de présenter QUALYPSO, la méthode d’analyse développée pour caractériser ce type d’ensemble et, de présenter les résultats des analyses réalisées avec l’ensemble Explore2 pour les projections du climat régional et de débits des rivières françaises. Différents variables et indicateurs sont considérés : température moyenne, cumul de précipitation et évapotranspiration, en moyenne à l’échelle des saisons estivales et hivernales ; débit annuel, débit journalier maximum annuel, débit mensuel minimal de chaque année pour différents bassins versants. Pour caractériser l’ensemble de projections produit pour la variable ou l’indicateur considéré, nous estimons : la moyenne d’ensemble, l’incertitude totale associée à cet ensemble, ainsi que les projections basses et hautes, la contribution des différentes sources d’incertitude à cette incertitude totale, en particulier les incertitudes dues à la chaîne de modélisation et les incertitudes dues à la variabilité interne du climat, les effets principaux de chaque modèle individuel et leur contribution à l’incertitude totale. Les analyses pour les variables climatiques couvrent le territoire français métropolitain. Elles sont réalisées en tout point de grille de la grille SAFRAN (8 km x 8 km). Les analyses pour les indicateurs hydrologiques sont produites pour un large nombre de bassins versants. Les résultats sont présentés sous forme cartographique pour différents horizons temporels (futur proche, milieu de siècle, fin de siècle) et sous forme chronologique pour différents bassins versants illustratifs. Les premières représentations permettent d’apprécier la variabilité spatiale des estimations sur le territoire français, les secondes permettent d’apprécier leur évolution temporelle sur le siècle à venir. Ces analyses fournissent une appréciation approfondie des évolutions projetées dans l’ensemble Explore2. Il est cependant important de mentionner que les résultats présentés sont conditionnels à cet ensemble, et donc au choix des scénarios et des modèles utilisés. Aucun des scénarios RCP ne se réalisera à l’identique et les modèles sont tous des représentations simplifiées et imparfaites des systèmes physiques réels (climat, cycle hydrologique). De ce fait, et ceci est valable quel que soit l’ensemble considéré, il ne faut pas donner à la moyenne d’ensemble et à la plage d’incertitude estimées une valeur qu’elles n’ont pas. En particulier, la plage d’incertitude ne correspond pas à la plage des incertitudes réelles. Même si elle peut en donner une idée, elle ne couvre pas nécessairement le futur qui se réalisera dans les décennies à venir. Malgré tout, la connaissance de ces incertitudes devrait permettre d’imaginer des adaptations plus robustes aux changements à venir.","explore2","Earth and Environmental Sciences","incertitude; projection; climat; hydrologie",2,"2024-07-01T14:45:14Z","Évin, Guillaume; Hingray, Benoît; Reverdy, Alix; Ducharne, Agnès; Sauquet, Éric",868,280,215,116,69555794,0.065
"doi:10.57745/SO2WOV","https://doi.org/10.57745/SO2WOV","Result of a visual detection of non-natural records in streamflow time series for the Explore2 project","Strohmenger, Laurent; Thirel, Guillaume, 2023, ""Result of a visual detection of non-natural records in streamflow time series for the Explore2 project"", https://doi.org/10.57745/SO2WOV, Recherche Data Gouv, V2, UNF:6:DLtVjZm68eXARzdu4r3rSg== [fileUNF]","The dataset collects anomalies reported during a visual inspection of for 570 (611 minus 41 stations belonging to the EDF network) streamflow time series available on the French database Hydroportail (https://hydro.eaufrance.fr/, date of extraction: 2021-03-01). Visual inspections were conducted in the first semester of 2022 as part of the Explore2 project. Streamfow time series were visually analysed by 43 evaluators (mostly hydrologists) in order to flag periods of anomalies that may reflect non-natural streamflow or measurement disturbance. Five types of anomalies were available: linear interpolation, drops, noise, point anomaly, and other. Description of the fields: code_station_h3: Code of the hydrometric station in relation to the SANDRE reference used in Hydroportail [10 characters] code_site_h3: Code of the hydrometric site in relation to the SANDRE reference used in Hydroportail [10 characters] code_h2: Former code of the hydrometric station in relation to the SANDRE reference used in Banque Hydro [8 characters] name_station_h3: Name of the station (Name of the river and nearest town) in Hydroportail [characters] name_site_h3: Name of the site (Name of the river and nearest town) in Hydroportail [characters] name_h2: Former name of the station (Name of the river and nearest town) used in Banque Hydro [characters] start: Date of the first day of the anomaly [YYYY-MM-DD] end: Date of the last day of the anomaly [YYYY-MM-DD] type: Type of anomaly reported [“Linear interpolation”, “Drops”, “Noise”, “Point anomaly”, and “Other”] evaluator: Anonymized evaluator code [2 characters]","hycar","Earth and Environmental Sciences","",2,"2023-02-09T16:03:57Z","Strohmenger, Laurent; Thirel, Guillaume",297,174,16,7,NA,NA
"doi:10.57745/9RYY9O","https://doi.org/10.57745/9RYY9O","Production de projections hydro-climatiques en Outre-Mer","Siauve, Sonia; Dijoux, Salomé; Bornancin-Plantier, Audrey; Sauquet, Éric, 2024, ""Production de projections hydro-climatiques en Outre-Mer"", https://doi.org/10.57745/9RYY9O, Recherche Data Gouv, V1","L’objectif du projet Explore2 est de donner à voir le climat et l’hydrologie naturelle futurs, à horizon 2100, sur une maille de 8 km x 8 km ; en se basant sur les résultats du 5ème rapport du GIEC et en utilisant une approche multi-modèles et multi-scénario pour assurer la robustesse scientifique de l’exercice et pouvoir associer des incertitudes aux simulations calculées. Etant donné le retour d’expériences du projet Explore 2070 sur les territoires d’Outre-Mer (OM) et malgré les progrès faits depuis 10 ans, le projet Explore2 ne pourra pas produire de projections hydro climatiques à horizon 2100 sur les territoires ultra-marins, mais uniquement en France métropolitaine. La principale raison est l’existence d’un certain nombre de verrous scientifiques, comme le manque de données d’observation disponibles par exemple, indispensables à la validation des modèles utilisés ; des explications détaillées sont présentées en section 3 de ce rapport. Il a été proposé, dans le cadre du projet Explore2, d’établir une feuille de route pour les territoires ultra-marins afin de remédier à la situation et de pouvoir programmer, dès que possible dans les années à venir, la réalisation d’un exercice scientifiquement robuste du type Explore2 dans chacun de ces territoires. Afin de permettre l’élaboration de ces feuilles de route, nous avons commencé notre « Zoom Outre-Mer » du projet Explore2 par la réalisation de ce rapport de connaissances comportant trois principales parties : - Recueil de connaissances dans les territoires ultra-marins des projets ayant été menés ou encore en cours sur le thème « adaptation au changement climatique et gestion des ressources en eau » (section 2, page 8) ; ce travail a été réalisé par une médiatrice scientifique de l’OiEau sur la base de recherches bibliographiques et d’interviews ciblées de porteurs de projets en OM, - Analyse des freins actuels à la réalisation d’un exercice de type Explore2 en OM (section 3, page 14) ; ce travail a été réalisé par le coordinateur du volet scientifique d’Explore 2 d’INRAE, - Perspectives pour établir des feuilles de route pour chaque territoire ultra-marins, en vue de l’élaboration de projections hydro-climatiques dans ces territoires (section 4, page 19) ; ce travail sera mené par la coordinatrice du volet « Accompagnement des acteurs » d’Explore2 de l’OiEau.","explore2","Earth and Environmental Sciences","département d'outre-mer; projections hydro-climatiques; connaissances et freins",1,"2024-05-31T13:51:01Z","Siauve, Sonia; Dijoux, Salomé; Bornancin-Plantier, Audrey; Sauquet, Éric",105,73,16,14,1199911,0.001
"doi:10.57745/DE9SPE","https://doi.org/10.57745/DE9SPE","Identification de stations hydrométriques et piézomètres pour l’évaluation des modélisations hydrologiques et hydrogéologiques","Sauquet, Éric; Vergnes, Jean-Pierre; Thirel, Guillaume; Strohmenger, Laurent, 2024, ""Identification de stations hydrométriques et piézomètres pour l’évaluation des modélisations hydrologiques et hydrogéologiques"", https://doi.org/10.57745/DE9SPE, Recherche Data Gouv, V1","Les modèles qui simulent des débits et des niveaux piézométriques en temps futur ont besoin d’être évalués en comparant de la manière la plus objective les données simulées en temps présent à des données observées sur un ensemble de points de mesure. Tous les points de mesure ne peuvent pas contribuer à cette évaluation. Les modèles mobilisés dans Explore2 simulent une ressource naturelle : le contrôle doit s’opérer là où l’empreinte anthropique est faible. Le rapport mentionne les modalités de sélection des séries journalières de débits et de niveaux piézométriques. Outre des critères de représentativité hydrologique, la sélection s’est appuyée sur des critères de longueur de chronique, des informations sur la qualité des mesures, des indicateurs de pression sur la ressource (prélèvements en eau) ou de potentielles perturbations (présence d’ouvrages hydrauliques en amont) et une expertise des usages sur les bassins versants ou à proximité de piézomètres. La sélection croise les informations disponibles dans les bases de données nationales (BNPE, HYDRO, ADES), internationale (AQUASTAT) ou constituées par les partenaires (EDF, INRAE). Les séries candidates de débits ont ensuite fait l’objet d’une ultime analyse de chaque série par deux individus (identification de données aberrantes par comparaison aux données de pluie et température, et aux sorties d’un modèle). Finalement, à la date du 1er juillet 2022, 611 séries de débits et 227 séries de niveau piézométrique ont été retenues pour évaluer les modèles hydrologiques.","explore2","Earth and Environmental Sciences","réseau de référence; BNPE; HYDRO; AQUASTAT; ADES",1,"2024-05-31T17:13:58Z","Sauquet, Éric; Vergnes, Jean-Pierre; Thirel, Guillaume; Strohmenger, Laurent",189,86,39,34,3157112,0.003
